<?xml version="1.0" encoding="UTF-8"?>
<!DOCTYPE content SYSTEM "content.dtd">
<content>
    <title>Costa Tran's Portfolio</title>
    <homepage>Homepage</homepage>
    <cv>Resume</cv>
    <about>About me</about>
    <about_content>Student at Sup Galilée engineering school, specializing in computer science, and apprentice software engineer at Forvia.</about_content>
    <video>Video presentation</video>
    <copyright>&#169; 2024 Costa TRAN. All rights reserved.</copyright>
</content>
